Sheet: Sheet1
A1: sI | B1: of:=sI -> 0 | E1: sJ | F1: of:=sJ -> 0.001 | I1: rOPO | J1: 0
B2: 0 | F2: 0 | J2: 1
A3: rOIO | B3: of:=[.B1] -> 0 | E3: rOJO | F3: of:=[.F1] -> 0.001 | J3: 0
B4: of:=[.B2]*2 -> 0 | F4: 0
B5: 0 | F5: of:=[.F2]*2 -> 0
A6: prOIOpsI | B6: 1 | C6: 0 | E6: prOJOpsJ | F6: 1 | G6: 0
B7: 0 | C7: 2 | F7: 0 | G7: 0
B8: 0 | C8: 0 | F8: 0 | G8: 2
A10: rIJO | B10: of:=rOJO-rOIO -> 0.001 | F10: rIJ | G10: of:=SQRT(SUMSQ(rIJO)) -> 0.001 | I10: rIJH | J10: of:=SQRT(SUMSQ(rIJO) + 1) -> 1.00000049999988 | L10: 1 over rIJH | M10: prTps*r
B11: 0 | I11: prIJHpsI | J11: of:=[.L11:.L14]*[.M11:.M14] -> -0.000999999500000375 | L11: of:=1/rIJH -> 0.999999500000375 | M11: of:=MMULT(TRANSPOSE(prIJOpsI);rIJO) -> -0.001
B12: 0 | J12: 0 | L12: 0.999999500000375 | M12: 0
A13: prIJOpsI | B13: of:=-prOIOpsI -> -1 | C13: -0 | I13: prIJHpsJ | J13: 0.000999999500000375 | L13: 0.999999500000375 | M13: of:=MMULT(TRANSPOSE(prIJOpsJ);rIJO) -> 0.001
B14: -0 | C14: -2 | J14: 0 | L14: 0.999999500000375 | M14: 0
B15: -0 | C15: -0
A16: prIJOpsJ | B16: of:=prOIOpsJ -> 1 | C16: 0 | L16: 1 over rIJH | N16: -prps*prpsT | P16: pprpss*r | R16: prTps*prps
B17: 0 | C17: 0 | I17: pprIJHpsIpsI | J17: of:=[.L17:.M22]*([.N17:.O22]+[.R17:.S22]) -> 0.999998500001875 | K17: 0 | L17: of:=1/rIJH -> 0.999999500000375 | M17: 0.999999500000375 | N17: of:=-MMULT(prIJHpsI;TRANSPOSE(prIJHpsI)) -> -0.000000999999000001 | O17: -0 | R17: of:=MMULT(TRANSPOSE(prIJOpsI);prIJOpsI) -> 1 | S17: 0
B18: 0 | C18: 2 | J18: 0 | K18: 3.9999980000015 | L18: 0.999999500000375 | M18: 0.999999500000375 | N18: -0 | O18: -0 | R18: 0 | S18: 4
I19: pprIJHpsIpsJ | J19: -0.999998500001875 | K19: 0 | L19: 0.999999500000375 | M19: 0.999999500000375 | N19: of:=-MMULT(prIJHpsI;TRANSPOSE(prIJHpsJ)) -> 0.000000999999000001 | O19: -0 | R19: of:=MMULT(TRANSPOSE(prIJOpsI);prIJOpsJ) -> -1 | S19: 0
J20: 0 | K20: 0 | L20: 0.999999500000375 | M20: 0.999999500000375 | N20: -0 | O20: -0 | R20: 0 | S20: 0
I21: pprIJHpsJpsJ | J21: 0.999998500001875 | K21: 0 | L21: 0.999999500000375 | M21: 0.999999500000375 | N21: of:=-MMULT(prIJHpsJ;TRANSPOSE(prIJHpsJ)) -> -0.000000999999000001 | O21: -0 | R21: of:=MMULT(TRANSPOSE(prIJOpsJ);prIJOpsJ) -> 1 | S21: 0
J22: 0 | K22: 3.9999980000015 | L22: 0.999999500000375 | M22: 0.999999500000375 | N22: -0 | O22: -0 | R22: 0 | S22: 4
A24: rIPO | B24: of:=rOPO-rOIO -> 0 | F24: rIP | G24: of:=SQRT(SUMSQ(rIPO)) -> 1 | I24: rIPH | J24: of:=SQRT(SUMSQ(rIPO) + 1) -> 1.4142135623731 | L24: 1 over rIPH | M24: prTps*r
B25: 1 | I25: prIPHpsI | J25: of:=[.L25:.L26]*[.M25:.M26] -> 0 | L25: of:=1/rIPH -> 0.707106781186548 | M25: of:=MMULT(TRANSPOSE(prIPOpsI);rIPO) -> 0
B26: 0 | J26: -1.4142135623731 | L26: 0.707106781186548 | M26: -2
A27: prIPOpsI | B27: of:=-prOIOpsI -> -1 | C27: -0
B28: -0 | C28: -2
B29: -0 | C29: -0
L30: 1 over rIPH | N30: -prps*prpsT | P30: pprpss*r | R30: prTps*prps
I31: pprIPHpsIpsI | J31: of:=[.L31:.M32]*([.N31:.O32]+[.R31:.S32]) -> 0.707106781186548 | K31: 0 | L31: of:=1/rIPH -> 0.707106781186548 | M31: 0.707106781186548 | N31: of:=-MMULT(prIPHpsI;TRANSPOSE(prIPHpsI)) -> -0 | O31: -0 | R31: of:=MMULT(TRANSPOSE(prIPOpsI);prIPOpsI) -> 1 | S31: 0
J32: 0 | K32: 1.4142135623731 | L32: 0.707106781186548 | M32: 0.707106781186548 | N32: -0 | O32: -2 | R32: 0 | S32: 4
B34: old x | D34: Jacobian | J34: error | L34: dx | N34: new x
A35: sI | B35: 0 | D35: of:=pprIPHpsIpsI+lam*pprIJHpsIpsI -> 1.70710528118842 | E35: 0 | F35: of:=lam*pprIJHpsIpsJ -> -0.999998500001875 | G35: 0 | H35: of:=prIJHpsI -> -0.000999999500000375 | J35: of:=prIPHpsI+lam*prIJHpsI -> -0.000999999500000375 | L35: of:=MMULT(MINVERSE(Jacobian);-error) -> 0 | N35: of:=[.B35:.B39]+[.L35:.L39] -> 0
B36: 0 | D36: 0 | E36: 5.4142115623746 | F36: 0 | G36: 0 | H36: 0 | J36: -1.4142135623731 | L36: 0.26120397145191 | N36: 0.26120397145191
A37: sJ | B37: 0.001 | D37: of:=lam*TRANSPOSE(pprIJHpsIpsJ) -> -0.999998500001875 | E37: 0 | F37: of:=lam*pprIJHpsJpsJ -> 0.999998500001875 | G37: 0 | H37: of:=prIJHpsJ -> 0.000999999500000375 | J37: of:=lam*prIJHpsJ -> 0.000999999500000375 | L37: -0.000500000125058651 | N37: 0.000499999874941349
B38: 0 | D38: 0 | E38: 0 | F38: 0 | G38: 3.9999980000015 | H38: 0 | J38: 0 | L38: 0 | N38: 0
A39: lam | B39: 1 | D39: of:=TRANSPOSE(prIJHpsI) -> -0.000999999500000375 | E39: 0 | F39: of:=TRANSPOSE(prIJHpsJ) -> 0.000999999500000375 | G39: 0 | H39: 0 | J39: of:=rIJH - 1 -> 0.00000049999987505878 | L39: -0.500000374940974 | N39: 0.499999625059026
B42: 0.1
B43: 0
B44: 0.1
B45: 0
B46: 1